{"authority":{"metric":{"kind":"exact_match"},"mode":"deterministic_per_record","reason":null},"execution":{"dependency_lock_sha256":"sha256:b0d9b5ba5d3cdd303187e350a5655b0e7693ad65295139a268c9043354c44b2f","runner_sha256":"sha256:1a2bb3c0d9f46bc289f4401f97b850c7871cada309e8bd1b0fcd39060f92b571"},"format":"invarlock/evaluator-qualification-profile-v1","profile_id":"openevals","upstream":{"package":{"ecosystem":"pypi","name":"openevals","version":"0.2.0"},"project_url":"https://github.com/langchain-ai/openevals"}}
