{"authority":{"metric":{"kind":"exact_match"},"mode":"deterministic_per_record","reason":null},"execution":{"dependency_lock_sha256":"sha256:5c65fd13a097ee8c0b44664eb2a38cf741f4cc4dbd4b7fcd8f8a95e7ebf63821","runner_sha256":"sha256:ef3c685155c08111544b2d5e5f5912b22859223e0bd38000b2ce26100c1dead1"},"format":"invarlock/evaluator-qualification-profile-v1","profile_id":"ragas","upstream":{"package":{"ecosystem":"pypi","name":"ragas","version":"0.4.3"},"project_url":"https://docs.ragas.io/"}}
