{"authority":{"metric":{"kind":"exact_match"},"mode":"deterministic_per_record","reason":null},"execution":{"dependency_lock_sha256":"sha256:6c3bfffca5614ebf9cefe1b5dfa35b6721fdead8582288a7c44682e979969062","runner_sha256":"sha256:d28e6c9be2a91c8e90232e2ca90f7a633e94f836bfd67da2cb533fe24ec01472"},"format":"invarlock/evaluator-qualification-profile-v1","profile_id":"arize-phoenix-evals-literal-scalar-v1","upstream":{"package":{"ecosystem":"pypi","name":"arize-phoenix-evals","version":"3.3.0"},"project_url":"https://github.com/Arize-ai/phoenix"}}
