{"authority":{"metric":{"kind":"exact_match"},"mode":"deterministic_per_record","reason":null},"execution":{"dependency_lock_sha256":"sha256:1541f3883d7ae37c50c1aa7a1aaf879f6d14b8af08c98f50ce6c3b0c8f95d37f","runner_sha256":"sha256:9f556f01ccf886b410aa86d5731074a9a6105bc00ef42633eef2eefc7bba3c19"},"format":"invarlock/evaluator-qualification-profile-v1","profile_id":"opik","upstream":{"package":{"ecosystem":"pypi","name":"opik","version":"2.2.7"},"project_url":"https://github.com/comet-ml/opik"}}
