{"authority":{"metric":{"kind":"exact_match"},"mode":"deterministic_per_record","reason":null},"execution":{"dependency_lock_sha256":"sha256:b29072d4cf67c1841b908c4338594479a16f96b330d93c08b3ec255761a9a98e","runner_sha256":"sha256:0ba8b132b2bc5c65510465ef772391c62985c9dd5d0930637fe130cf0ad6972b"},"format":"invarlock/evaluator-qualification-profile-v1","profile_id":"evidently-strict-batch-v1","upstream":{"package":{"ecosystem":"pypi","name":"evidently","version":"0.7.21"},"project_url":"https://github.com/evidentlyai/evidently"}}
