{"authority":{"metric":{"kind":"exact_match"},"mode":"deterministic_per_record","reason":null},"execution":{"dependency_lock_sha256":"sha256:6c3bfffca5614ebf9cefe1b5dfa35b6721fdead8582288a7c44682e979969062","runner_sha256":"sha256:dd1fa83e9f544d6b4d32f6422406d2c76deed1d7ef12334afe9dffb440555efa"},"format":"invarlock/evaluator-qualification-profile-v1","profile_id":"arize-phoenix-evals","upstream":{"package":{"ecosystem":"pypi","name":"arize-phoenix-evals","version":"3.3.0"},"project_url":"https://github.com/Arize-ai/phoenix"}}
