{"authority":{"metric":{"kind":"exact_match"},"mode":"deterministic_per_record","reason":null},"execution":{"dependency_lock_sha256":"sha256:1816936c637b8b4f2cd8e0c540cfbf6d5bc6e989b227feb61f1ae592b0159937","runner_sha256":"sha256:82b89654afb0b70ee84b871ba025a3e58076f155279228e5d1aec93223bfa441"},"format":"invarlock/evaluator-qualification-profile-v1","profile_id":"deepeval","upstream":{"package":{"ecosystem":"pypi","name":"deepeval","version":"4.1.3"},"project_url":"https://deepeval.com/"}}
