{"authority":{"metric":{"kind":"exact_match"},"mode":"deterministic_per_record","reason":null},"execution":{"dependency_lock_sha256":"sha256:e8a6a0abaddf17d957e38e725f9406bfe20d6dcd116b225de6f4d1dbf4c9867f","runner_sha256":"sha256:d28e6c9be2a91c8e90232e2ca90f7a633e94f836bfd67da2cb533fe24ec01472"},"format":"invarlock/evaluator-qualification-profile-v1","profile_id":"lm-evaluation-harness-literal-scalar-v1","upstream":{"package":{"ecosystem":"pypi","name":"lm-eval","version":"0.4.12"},"project_url":"https://github.com/EleutherAI/lm-evaluation-harness"}}
