{"authority":{"metric":{"kind":"exact_match"},"mode":"deterministic_per_record","reason":null},"execution":{"dependency_lock_sha256":"sha256:b29072d4cf67c1841b908c4338594479a16f96b330d93c08b3ec255761a9a98e","runner_sha256":"sha256:f803ee7006bd2fdd43d522780060365c588d55a4b2b1c2c281fddfb6f3ad7a00"},"format":"invarlock/evaluator-qualification-profile-v1","profile_id":"evidently","upstream":{"package":{"ecosystem":"pypi","name":"evidently","version":"0.7.21"},"project_url":"https://github.com/evidentlyai/evidently"}}
