{"authority":{"metric":{"kind":"exact_match"},"mode":"deterministic_per_record","reason":null},"execution":{"dependency_lock_sha256":"sha256:0d731fc22c32eb612a991373d8ddd587f14116286a079f6ac447068019befca2","runner_sha256":"sha256:0ba8b132b2bc5c65510465ef772391c62985c9dd5d0930637fe130cf0ad6972b"},"format":"invarlock/evaluator-qualification-profile-v1","profile_id":"pydantic-evals-strict-batch-v1","upstream":{"package":{"ecosystem":"pypi","name":"pydantic-evals","version":"2.18.0"},"project_url":"https://ai.pydantic.dev/evals/"}}
