{"authority":{"metric":{"kind":"exact_match"},"mode":"deterministic_per_record","reason":null},"execution":{"dependency_lock_sha256":"sha256:88ee5e90347d25164e23fa552ec5f1e4dd9910490858022296a0d4c238f2142b","runner_sha256":"sha256:cf0d7ff75d78bd7b6392028905a0fbf59b4eb3ef0fde3b0cf7ed2ceb1c0cc04f"},"format":"invarlock/evaluator-qualification-profile-v1","profile_id":"hugging-face-evaluate","upstream":{"package":{"ecosystem":"pypi","name":"evaluate","version":"0.4.6"},"project_url":"https://huggingface.co/docs/evaluate/"}}
